{
  "schemaVersion": "cineweave.core-lock.v1",
  "coreRepository": "https://example.invalid/cineweave-core.git",
  "coreCommit": "1111111111111111111111111111111111111111",
  "editionContractSha256": "1111111111111111111111111111111111111111111111111111111111111111",
  "ddlOwnerManifestSha256": "2222222222222222222222222222222222222222222222222222222222222222",
  "overlaySlotsSha256": "3333333333333333333333333333333333333333333333333333333333333333",
  "releaseManifestSchemaSha256": "4444444444444444444444444444444444444444444444444444444444444444",
  "openAPIContractSha256": "5555555555555555555555555555555555555555555555555555555555555555",
  "eventCatalogSha256": "6666666666666666666666666666666666666666666666666666666666666666",
  "coreMigrationHead": 70
}
